,XID,Name,Kind,City,OSM,WikiData,Rate,Lon,Lat,NewWikiData,Description
0,N552713468,Н.А. Некрасову,"historic,monuments_and_memorials,interesting_places,monuments",Ярославль,node/552713468,Q4343284,3h,39.892933,57.632572,Q4343284,"Памятник Некрасову — памятник в Ярославле Николаю Алексеевичу Некрасову — русскому поэту, писателю, публицисту, учившемуся в Ярославской гимназии."
1,W125448768,Российский государственный академический театр драмы имени Федора Волкова,"cultural,theatres_and_entertainments,interesting_places,other_theatres",Ярославль,way/125448768,Q4398052,3h,39.884796,57.627155,Q4398052,"Росси́йский госуда́рственный академи́ческий теа́тр дра́мы имени Ф. Во́лкова — старейший драматический театр России. Основан в 1750 году. Здание расположено в центре Ярославля по адресу: площадь Волкова, 1.16 сентября 2019 года театру присвоен статус особо ценного объекта культурного наследия.Художественный руководитель театра — Валерий Кириллов, директор — Герман Громов."
2,W239408057,Ярославская соборная мечеть,"religion,other_temples,interesting_places",Ярославль,way/239408057,Q4281966,3h,39.875633,57.636059,Q4281966,"Ярославская соборная мечеть — мечеть в Ярославле. Расположена на улице Победы, дом 20.В мечети проводятся: обычные молитвы, джума, таравих."
3,W44896191,Церковь Спаса на городу,"religion,churches,interesting_places,eastern_orthodox_churches",Ярославль,way/44896191,Q16715792,3h,39.895622,57.622604,Q16715792,"Церковь Спаса на Городу (Спасо-Нагородская церковь, церковь Происхождения Честных Древ Креста Господня, что на Городу) — приходской православный храм в историческом центре Ярославля. Один из лучших образцов ярославского храмового зодчества XVII века. Относится к Ярославскому центральному городскому благочинию Ярославской епархии Русской православной церкви."
4,W45013546,Спасо-Преображенский собор,"religion,cathedrals,monasteries,interesting_places",Ярославль,way/45013546,Q1078595,3h,39.889511,57.621506,Q1078595,"Ярославский Спасо-Преображенский монастырь (Спасо-Ярославский монастырь) — древний упразднённый мужской монастырь в Ярославле, сыгравший важную роль в местной истории. Основан князем Константином Всеволодовичем в 1216 году. Располагается в историческом центре города, на берегу реки Которосль. На его территории находятся памятники архитектуры XVI—XIX веков. Здесь был найден список «Слова о полку Игореве» — памятника древнерусской литературы."
5,W92405439,Николая Чудотворца,"religion,churches,interesting_places,other_churches",Ярославль,way/92405439,Q4504845,3h,39.865314,57.61031,Q4504845,"Церковь Николая Чудотворца Пенская (Николо-Пенская церковь, храм Святого Николая на Пенье) — православный храм в южной части Ярославля, в посёлке Толчково. Построен на средства прихожан в 1689—1690 годах как тёплый храм Фёдоровского прихода.В советское время (до 1987 года) функционировал в качестве кафедрального собора Ярославской епархии. Это единственный храм в старой части города, не закрытый в годы советской власти."
6,W101704727,Владимирская церковь,"religion,churches,interesting_places,other_churches",Ярославль,way/101704727,Q4113263,3h,39.852306,57.625523,Q4113263,"Церковь Владимирской иконы Божией Матери на Божедо́мке — православный храм Ярославской епархии Русской православной церкви, расположенный в Ярославле. Один из последних в истории русского зодчества трёхшатровых храмов, единственный допетровский шатровый храм в городе.В 1992—2017 годах находился в ведении неканонической Российской православной автономной церкви и относился к Суздальской епархии РПАЦ."
7,W103292201,церковь Николая Чудотворца,"religion,churches,interesting_places,eastern_orthodox_churches",Ярославль,way/103292201,Q30913942,3h,39.870548,57.620068,Q30913942,"Церковь Николая Чудотворца Мокринская (Николо-Мокринская церковь, храм Николы Мокрого) — приходской православный храм в центральной части Ярославля, типичный ярославский посадский храм XVII века."
8,W173960067,Церковь Благовещения,"religion,churches,interesting_places,other_churches",Ярославль,way/173960067,Q4087788,3h,39.891327,57.634312,Q4087788,"Благовещенско-Вознесенский приход — приход в городе Ярославле, относится к Ярославской епархии Русской православной церкви. Настоятель — протоиерей Алексий Авксентьев."
9,W48274072,Часовня Александра Невского,"religion,churches,interesting_places,other_churches",Ярославль,way/48274072,Q4507592,3h,39.891064,57.625462,Q4507592,"Часо́вня Алекса́ндра Не́вского (полное название: Часовня Успенского собора в память 17 октября 1888 года во имя святых Александра Невского, Марии Магдалины, Николая Чудотворца, великомученика Георгия, Михаила Архангела, преподобной Ксении, княгини Ольги) — православная часовня в Ярославле. Построена в 1889—1892 годах на Мытном дворе по проекту архитектора Николая Поздеева на месте часовни 1820-х годов."
10,W76701664,Храм Великомученика Никиты,"religion,churches,interesting_places,other_churches",Ярославль,way/76701664,Q4319898,3h,39.868584,57.623791,Q4319898,"Никитский приход в одноимённой слободе на западной окраине средневекового Ярославля возник не позднее XV века. Слобода с таким названием впервые упоминается в грамоте Василия III от 1511 года. В приходе было два небольших храма с приделами, посвящёнными Никите Мученику (единственный случай такого двойного посвящения в городе).Находится вблизи пересечения улицы Победы и улицы Салтыкова-Щедрина."
11,W45013536,Церковь Богоявления Господня,"religion,churches,interesting_places,eastern_orthodox_churches",Ярославль,way/45013536,Q4504600,3h,39.88644,57.621643,Q4504600,"Церковь Богоявления Господня в Ярославле, также известная как Богоявленская церковь, является одной из главных достопримечательностей города. Она расположена в историческом центре Ярославля и славится своей уникальной архитектурой, сочетающей в себе элементы древнерусского зодчества и барокко."
12,W95564000,Воинское мемориальное кладбище,"cemeteries,historic,burial_places,interesting_places,war_memorials",Ярославль,way/95564000,Q4122453,3h,39.830746,57.631962,Q4122453,"Воинское мемориальное кладбище — воинское кладбище-мемориал в городе Ярославле. Является частью Леонтьевского кладбища. Расположено на Угличской улице, через дорогу от Музея боевой славы. Открыто для посещения с 9 до 16 часов."
13,N1361341279,Кирило-Афанасиевский мужской монастырь,"religion,monasteries,interesting_places",Ярославль,node/1361341279,Q4221355,3h,39.895275,57.625294,Q4221355,"Спасо-Афанасиевский монастырь — мужской монастырь Ярославской епархии Русской православной церкви, расположенный в историческом центре Ярославля."
14,W123291538,Крестоборогодская церковь,"religion,churches,interesting_places,other_churches",Ярославль,way/123291538,Q4240367,3h,39.849354,57.578876,Q4240367,"Крестобогородская церковь (Церковь Ризоположения в Крестах) — православный храм на южной окраине Ярославля, в местности Кресты (бывшее село Крестобогородское)."
15,W95943760,Церковь Николы в Меленках,"religion,churches,interesting_places,eastern_orthodox_churches",Ярославль,way/95943760,Q104554178,3h,39.834522,57.609947,Q104554178,"Церковь Николая Чудотворца в Меленках (Николо-Мельницкая церковь, церковь Николы в Меленках) — приходской православный храм в южной части Ярославля, в бывшей Мельницкой слободе на берегу Которосли."
16,W44898055,Музей истории города Ярославля,"cultural,museums,children_museums,interesting_places,history_museums,local_museums",Ярославль,way/44898055,Q4306319,3h,39.898617,57.627079,Q4306319,"Музей истории города Ярославля — музей в городе Ярославле, посвящённый его истории."
17,W140038051,Николо-Тропинская церковь,"religion,architecture,historic_architecture,churches,interesting_places,destroyed_objects,other_churches",Ярославль,way/140038051,Q4320780,3h,39.891727,57.613121,Q4320780,"Церковь Николая Чудотворца в Тропине — православный храм в Ярославле, в посёлке Тропино на правом берегу Которосли."
18,W44899216,Волжская башня,"towers,architecture,interesting_places,other_towers",Ярославль,way/44899216,Q4123105,3h,39.901684,57.625027,Q4123105,"Во́лжская ба́шня (Во́лжские воро́та, Арсена́льная ба́шня) — бывшая крепостная башня в Ярославле, одна из трёх сохранившихся башен Земляного города."
19,W82251166,Сретенский храм,"religion,churches,interesting_places,eastern_orthodox_churches",Ярославль,way/82251166,Q4438830,3h,39.888905,57.625244,Q4438830,"Церковь Сретения Господня — православный храм в историческом центре Ярославля, в Депутатском (Сретенском) переулке."
20,N4997897721,Знаменская церковь,"towers,religion,architecture,churches,interesting_places,other_towers,other_churches",Ярославль,node/4997897721,Q4113610,3h,39.885262,57.625439,Q4113610,"Вла́сьевская (Зна́менская) башня — бывшая крепостная башня в Ярославле, одна из трёх сохранившихся башен Земляного города.Первое название башни происходит от находившейся рядом древней Власьевской церкви, второе — от Знаменской церкви, пристроенной к башне с восточной стороны в середине XIX века. Башню также называли Углицкими воротами, так как от неё начиналась дорога в Углич."
21,W44899213,Музей древнерусского искусства,"cultural,museums,interesting_places,art_galleries",Ярославль,way/44899213,Q4296770,3h,39.902294,57.623344,Q4296770,Митрополичьи палаты — один из старейших сохранившихся памятников гражданской архитектуры города Ярославля (XVII век).
22,N1234995463,Ярославский музей-заповедник,"cultural,museums,archaeological_museums,interesting_places,history_museums,open_air_museums,art_galleries",Ярославль,node/1234995463,Q4538889,3h,39.89003,57.620876,Q4538889,"Яросла́вский госуда́рственный исто́рико-архитекту́рный и худо́жественный музе́й-запове́дник — одно из крупнейших учреждений культуры и объектов туризма Ярославля. С 1959 года музей-заповедник располагается в самом центре города, на территории упразднённого в 1787 году Спасо-Преображенского мужского монастыря. Музею принадлежит богатая коллекция икон и рукописей, драгоценных тканей и церковной утвари, произведений древнерусского искусства. На территории музея находится древнейшее из сохранившихся в Ярославле зданий — Спасо-Преображенский собор (начало XVI века), кроме этого в состав музея-заповедника входят шесть церквей, являющихся важнейшими ярославскими памятниками архитектуры и живописи XVII века."
23,W92405434,церковь Иоанна Предтечи в Толчкове,"religion,churches,interesting_places,eastern_orthodox_churches",Ярославль,way/92405434,Q2084804,3h,39.856861,57.610909,Q2084804,"Це́рковь Иоа́нна Предте́чи в Толчко́ве — недействующий православный храм в Ярославле, уникальный памятник русской архитектуры XVII века и одно из самых знаменитых произведений Ярославской школы зодчества периода её наивысшего расцвета. Единственный в России пятнадцатиглавый храм. Расположен в южной части города, в посёлке Толчково на берегу Которосли."
24,W271115386,Толгский Ярославский в честь Введения во храм Пресвятой Богородицы монастырь,"religion,monasteries,interesting_places",Ярославль,way/271115386,Q1776349,3h,39.82869,57.697281,Q1776349,"Введенский То́лгский монасты́рь — женский монастырь Ярославской епархии Русской православной церкви, расположенный в Ярославле на левом берегу Волги.Основан как мужской в 1314 году епископом Ростовским Прохором (в схиме Трифоном) на месте чудесного обретения им иконы Богородицы (Толгская икона), ставшей главной святыней обители. Название получил по имени протекающей рядом речки Толги. В 1987 году после почти шестидесяти лет закрытия вновь открыт как женский."
25,W183940992,Храм Зосимы и Савватия,"religion,churches,interesting_places,eastern_orthodox_churches",Ярославль,way/183940992,Q16715602,3h,39.903271,57.636955,Q16715602,"Це́рковь Зоси́мы и Савва́тия — православный храм в Ярославле, на Тверицкой набережной. Бывшая зимняя церковь Тверицкого прихода. Ныне — региональный морской храм Ярославской епархии."
26,W187948282,Храм Архангела Михаила,"religion,churches,interesting_places,eastern_orthodox_churches",Ярославль,way/187948282,Q60850718,3h,39.764675,57.738789,Q60850718,"Церковь Михаила Архангела в Норском — православный храм в северной части Ярославля, в посёлке Норское. Построен в 1748 году на средства прихожан. В архитектурном плане храм является типичным для провинциального ярославского зодчества XVIII века."
27,W44900364,церковь Николы Рублёного,"religion,churches,interesting_places,eastern_orthodox_churches",Ярославль,way/44900364,Q16715656,3h,39.898258,57.622509,Q16715656,"Церковь Николая Чудотворца в Рубленом Городе (Николо-Рубленская церковь, церковь Николы Рубленого) — недействующий православный храм в Ярославле на Которосльной набережной. Единственный храм на территории бывшего Ярославского кремля, сохранившийся с XVII века, причём в первоначальном облике. Название церкви отражает её расположение в древней крепости с бревенчатыми стенами — Рубленом городе."
28,N4618248825,Казанский женский монастырь,"religion,monasteries,interesting_places",Ярославль,node/4618248825,Q4207801,3h,39.886944,57.627979,Q4207801,Каза́нский монасты́рь — женский монастырь в историческом центре Ярославля. Относится к Ярославской епархии Русской православной церкви.
29,W107535735,Церковь Софии Премудрости Божией в Савино,"religion,other_temples,interesting_places",Ярославль,way/107535735,Q16715786,3h,39.919182,57.623425,Q16715786,"Церковь Софии Премудрости Божией в Савине — православный храм в заволжской части Ярославля, в посёлке Савино. Расположен на левом берегу реки Волги."
30,W92405450,Федоровский собор,"religion,churches,interesting_places,eastern_orthodox_churches",Ярославль,way/92405450,Q4494153,3h,39.865444,57.609676,Q4494153,"Церковь Феодоровской иконы Божией Матери в Толчкове (Фёдоровская церковь) — приходской православный храм в южной части Ярославля, в посёлке Толчково на берегу Которосли. С 1987 года до освящения в 2010 году нового Успенского собора была кафедральным собором Ярославско-Ростовской епархии.В ансамбль бывшего Николо-Пенского прихода, а ныне Феодоровского архиерейского подворья входят также тёплая Николо-Пенская церковь с колокольней и современный крестильный храм Равноапостольного Владимира (1999). Подворье окружено оградой, подле храма захоронено несколько архиереев. Имя храма носят две улицы, пересекающие Закоторосльную сторону города, — Большая Фёдоровская и Малая Фёдоровская (ныне Малая Пролетарская)."
31,W150447107,Церковь Николая Надеина,"religion,churches,museums,cultural,interesting_places,eastern_orthodox_churches,history_museums",Ярославль,way/150447107,Q4504840,3h,39.896023,57.628815,Q4504840,"Церковь Николая Чудотворца Наде́инская (разг. церковь Николы Наде́ина, Николо-Надеинская церковь) — недействующий православный храм в историческом центре Ярославля, на берегу Волги. Старейший из сохранившихся каменных памятников Ярославской школы зодчества XVII века. Находится в ведении Ярославской епархии и Ярославского музея-заповедника."
32,W44896201,Церковь Ильи Пророка,"religion,churches,interesting_places,eastern_orthodox_churches",Ярославль,way/44896201,Q4177920,3h,39.894485,57.626812,Q4177920,"Це́рковь Илии́ Проро́ка — православный храм в историческом центре Ярославля на Советской (Ильинской) площади, выдающийся памятник архитектуры Ярославской школы зодчества и живописи XVII века. Находится в ведении Ярославской епархии и Ярославского музея-заповедника."
33,W101935938,Церковь Вознесения Господня,"religion,churches,interesting_places,eastern_orthodox_churches",Ярославль,way/101935938,Q4114893,3h,39.871132,57.626507,Q4114893,"Церковь Вознесения Господня — характерный для ярославской школы приходской четырехстолпный пятиглавый храм с закрытыми галереями, возведённый по инициативе и на средства прихожан в 1677-82 гг. Стоит чуть восточнее Вознесенских казарм, на главной улице Ярославля — бывшей Власьевской, ныне Свободы, в нескольких шагах от площади Труда. В ансамбль прихода входит также тёплая Сретенская церковь (1689—1691, перестроена в конце XVIII века) — уникальный для Ярославля памятник культового зодчества в стиле елизаветинского барокко.Ансамбль в целом имеет статус объекта культурного наследия России регионального значения, в то время как церковь Вознесения Господня —  Объект культурного наследия народов РФ федерального значения. Рег. № 761410067240006 (ЕГРОКН). Объект № 7610059001 (БД Викигида)."
